{
  "id": "linux-anduinos",
  "version": 1,
  "family": "linux",
  "vendor": "anduin",
  "displayName": "AnduinOS",
  "bodyId": "anduinos",
  "embedKey": "anduinos",
  "tier": "P3",
  "status": "active",
  "paths": {
    "facade": "OS/linux/families/debian/anduinos/index.html",
    "skin": "home/Debian/AnduinOS/index.html"
  },
  "toolkit": {
    "id": "gnome",
    "shell": "gnome"
  },
  "assets": {
    "assetsBase": "../../../usr/share/capsuleos/assets",
    "toolkitPack": "toolkits/gnome",
    "vendorPack": "vendors/anduin",
    "iconPacks": [
      "icons/gnome"
    ]
  },
  "capsuleGlobals": {
    "CAPSULE_APPS_BASE": "../../../usr/share/capsuleos/linux/apps",
    "CAPSULE_SKIN_BASE": ".",
    "CAPSULE_STRINGS_URL": "./content/strings.json",
    "CAPSULE_EXPLORER_DISPLAY_NAME": "Fichiers",
    "CAPSULE_EXPLORER_TEMPLATE": "nemo-gnome",
    "CAPSULE_EMBED_SKIN_KEY": "anduinos",
    "CAPSULE_SITE_HOME": "../../../index.html",
    "CAPSULE_LINUX_HUB": "../../../OS/linux/index.html",
    "CAPSULE_TERMINAL_OS_FAMILY": "linux",
    "CAPSULE_TERMINAL_PROFILE": "debian",
    "CAPSULE_WINDOW_CHROME_CONTEXT": {
      "toolkitId": "gnome",
      "explorerTemplate": "nemo-gnome",
      "explorerDragMode": "app-headerbar-passthrough",
      "slotProviders": {
        "firefox": "firefox-gnome",
        "terminal": "terminal-gnome"
      }
    }
  }
}
